### ISSUE TITLE
[calico3.13.6] Ingress traffic of networkpolicy is restricted to service port, access timeout

### ISSUE THREAD

**Issue by njuptlzf** [projectcalico/felix#2836]
## Expected Behavior

access 

## Current Behavior

 access timeout
## Possible Solution

1. apply networkpolicy (add containerport 8080) or delete the networkpolicy in namespace lzf

## Steps to Reproduce (for bugs)

1. create pod and svc
```shell
# kubectl apply -n lzf -f- <<EOF
> apiVersion: apps/v1
    matchLabels:
      app: kubia
  template:
    metadata:
      name: kubia
> kind: Deployment
> metadata:
>   name: kubia-deploy
> spec:
>   replicas: 3
>   selector:
>     matchLabels:
>       app: kubia
>   template:
>     metadata:
>       name: kubia
>       labels:
>         app: kubia
>     spec:
>       containers:
>       - image: kubia:v1
>         name: nodejs
>         ports:
>         - name: http
>           containerPort: 8080
> EOF
```
```shell
kubectl apply -n lzf -f- <<EOF
apiVersion: v1
kind: Service
metadata:
  name: kubia1
spec:
  type: NodePort
  selector:
    app: kubia
  ports:
  - name: http
    port: 8080
    targetPort: 8080
    nodePort: 30644
EOF
```

2. create networkpolicy
```shell
kubectl apply -n lzf -f-  <<EOF
apiVersion: networking.k8s.io/v1
kind: NetworkPolicy
metadata:
  namespace: lzf
  name: lzf-access
spec:
  podSelector:
    matchLabels:
  ingress:
  - from:
    ports:
    - port: 30644
  policyTypes:
  - Ingress
  - Egress
EOF
```

3. enter container and dial 
```shell
# kubectl get svc -n lzf
NAME               TYPE        CLUSTER-IP      EXTERNAL-IP   PORT(S)          AGE
kubia1             NodePort    10.254.1.10     <none>        8080:30644/TCP   2m
# kubectl get po -n lzf -o wide
NAME                            READY   STATUS    RESTARTS   AGE   IP               NODE            NOMINATED NODE   READINESS GATES
kubia-deploy-6b4544dfb6-72wc4   1/1     Running   0          2m   172.22.172.153   192.168.122.1   <none>           <none>
# kubectl exec kubia-deploy-6b4544dfb6-72wc4 -n lzf -it bash
root@kubia-deploy-6b4544dfb6-72wc4:/# time curl 192.168.122.1:30644
curl: (7) Failed to connect to 192.168.122.1 port 30644: Connection timed out
real    2m10.695s
user    0m0.015s
sys     0m0.008s
root@kubia-deploy-6b4544dfb6-72wc4:/# curl 172.22.172.153:8080
You've hit kubia-deploy-6b4544dfb6-72wc4
```

**other logs:**
Tcpdump once saved, "access"
```shell
# tcpdump -i any tcp port 30644
tcpdump: verbose output suppressed, use -v or -vv for full protocol decode
listening on any, link-type LINUX_SLL (Linux cooked), capture size 262144 bytes
20:00:55.435391 IP 172.22.172.149.52734 > k8s.30644: Flags [S], seq 2000004901, win 64400, options [mss 1400,sackOK,TS val 1068253500 ecr 0,nop,wscale 7], length 0
20:00:55.435516 IP k8s.30644 > 172.22.172.149.52734: Flags [S.], seq 3526896468, ack 2000004902, win 65236, options [mss 1400,sackOK,TS val 352377053 ecr 1068253500,nop,wscale 7], length 0
20:00:55.435531 IP 172.22.172.149.52734 > k8s.30644: Flags [.], ack 1, win 504, options [nop,nop,TS val 1068253500 ecr 352377053], length 0
20:00:55.435598 IP 172.22.172.149.52734 > k8s.30644: Flags [P.], seq 1:84, ack 1, win 504, options [nop,nop,TS val 1068253500 ecr 352377053], length 83
20:00:55.435618 IP k8s.30644 > 172.22.172.149.52734: Flags [.], ack 84, win 510, options [nop,nop,TS val 352377053 ecr 1068253500], length 0
20:00:55.437237 IP k8s.30644 > 172.22.172.149.52734: Flags [P.], seq 1:146, ack 84, win 510, options [nop,nop,TS val 352377054 ecr 1068253500], length 145
20:00:55.437268 IP 172.22.172.149.52734 > k8s.30644: Flags [.], ack 146, win 503, options [nop,nop,TS val 1068253501 ecr 352377054], length 0
```
Tcpdump once saved, **access timeout**, it seems that ingress traffic is rejected.
```shell
20:01:53.490087 IP 172.22.172.149.52844 > k8s.30644: Flags [S], seq 3068757740, win 64400, options [mss 1400,sackOK,TS val 1068311554 ecr 0,nop,wscale 7], length 0
20:01:54.514017 IP 172.22.172.149.52844 > k8s.30644: Flags [S], seq 3068757740, win 64400, options [mss 1400,sackOK,TS val 1068312578 ecr 0,nop,wscale 7], length 0
20:01:56.530011 IP 172.22.172.149.52844 > k8s.30644: Flags [S], seq 3068757740, win 64400, options [mss 1400,sackOK,TS val 1068314594 ecr 0,nop,wscale 7], length 0
20:02:00.657998 IP 172.22.172.149.52844 > k8s.30644: Flags [S], seq 3068757740, win 64400, options [mss 1400,sackOK,TS val 1068318722 ecr 0,nop,wscale 7], length 0
20:02:08.850015 IP 172.22.172.149.52844 > k8s.30644: Flags [S], seq 3068757740, win 64400, options [mss 1400,sackOK,TS val 1068326914 ecr 0,nop,wscale 7], length 0
20:02:24.982012 IP 172.22.172.149.52844 > k8s.30644: Flags [S], seq 3068757740, win 64400, options [mss 1400,sackOK,TS val 1068343046 ecr 0,nop,wscale 7], length 0
20:02:58.770013 IP 172.22.172.149.52844 > k8s.30644: Flags [S], seq 3068757740, win 64400, options [mss 1400,sackOK,TS val 1068376834 ecr 0,nop,wscale 7], length 0
```
calico-node log:
```shell
2021-06-01 08:58:16.912 [INFO][69] int_dataplane.go 1034: Received *proto.ActivePolicyUpdate update from calculation graph msg=id:<tier:"default" name:"lzf/knp.default.lzf-access" > policy:<namespace:"lzf" inbound_rules:<action:"allow" protocol:<name:"tcp" > dst_ports:<first:30644 last:30644 > rule_id:"5Sc0aC-ptWF0FIFx" > >
```
**Q:**
1) I can't find where this updated resource is used, such as `calicoctl get <what?>`
2) Please indicate why the ingress traffic is restricted, how should I set it to `allow all ips to access the ingress traffic of service kubia1 (NodePort)`.
## Your Environment

* Felix version (if using Felix binary directly `calico-felix --version`):
* And/Or, `calico/node` container version (if running Felix in a container): calico-node 3.13.6
* Which orchestrator are you using (e.g. Kubernetes, OpenStack, Docker, Mesos): Kubernetes
* Orchestrator version (if used): 1.21-dirty (1 machine, master and minion all in one)
* Etcd version (if using etcd datastore driver): 3.4.13
* Operating System and version: Ubuntu 16.04.6 LTS
* Link to your project (optional):

If you have time, PTAL
/assign @song-jiang @fasaxc

**Comment by njuptlzf** [comment]
@caseydavenport 

/kind support

**Comment by lwr20** [comment]
I think this is how network policy is supposed to work.  Policies act on the pod, not the service. 

You may find https://github.com/ahmetb/kubernetes-network-policy-recipes helpful?

**Comment by njuptlzf** [comment]
> I think this is how network policy is supposed to work. Policies act on the pod, not the service.
> 
> You may find https://github.com/ahmetb/kubernetes-network-policy-recipes helpful?

I agree that v1.networkpolicy comes from staging/src/k8s.io/api/networking/v1/types.go, but I think it is used by felix. 

I am wondering why port: 30644 causes the connection to time out. 
How does calico handle when felix finds that networkpolicy is updated to 30644?

**Comment by lwr20** [comment]
> I am wondering why port: 30644 causes the connection to time out.
Because 30644 is the port for the NodePort, not the pod.  Kube-proxy then DNATs the packet and sends it to one of the backing pods on port 8080. Its at that point that Network Policy might happen and drop/allow the packet.

Nodeports are in the host network namespace.  If you want to put policy there, you need to follow:
https://docs.projectcalico.org/security/tutorials/protect-hosts

**Comment by njuptlzf** [comment]
Thank @lwr20 very much for your reply and for guiding me to learn in https://github.com/ahmetb/kubernetes-network-policy-recipes .

I found that calico-node implements networkpolicy rules and adds them to iptables,
```shell
-A cali-pi-_3yjNPIlutB4whnUsBdG -p tcp -m comment --comment "cali:6eohnkNjyCtSDgHS" -m multiport --dports 30644 -j MARK --set-xmark 0x10000/0x10000
-A cali-pi-_3yjNPIlutB4whnUsBdG -m comment --comment "cali:JjudqAMAvAletutd" -m mark --mark 0x10000/0x10000 -j RETURN
-A cali-tw-calib48837193d5 -m comment --comment "cali:Me2wD0Y4NkKzmS5t" -m comment --comment "Start of policies" -j MARK --set-xmark 0x0/0x20000
-A cali-tw-calib48837193d5 -m comment --comment "cali:0NFnw3jX2GqK9ryV" -m mark --mark 0x0/0x20000 -j cali-pi-_3yjNPIlutB4whnUsBdG
-A cali-tw-calib48837193d5 -m comment --comment "cali:hdEJS0_wLsf1alVA" -m comment --comment "Return if policy accepted" -m mark --mark 0x10000/0x10000 -j RETURN
-A cali-tw-calib48837193d5 -m comment --comment "cali:hFp3wMuxxZJcsbbk" -m comment --comment "Drop if no policies passed packet" -m mark --mark 0x0/0x20000 -j DROP
```
If the container port is not `30644`, it will be `DROP`, resulting in the final timeout.

/close
