### ISSUE TITLE
Long calico-node recovery time after kube-apiserver was gone

### ISSUE THREAD

**Issue by yousong** [projectcalico/felix#2421]
Suppose we have master nodeA and nodeB, each running kubelet, kube-apiserver and calico-node

 - calico-node pod on nodeA connects to kube-apiserver through local ipvs service 10.96.0.1:443.  The real server for this ipvs connection is nodeB
 - kubelet connects to apiserver through vip managed by keepalived

Then we make nodeB offline, by powering it off, `ip link set xx down`, etc.

nodeB becomes NotReady, pods originally on nodeB got migrated to nodeA.  calico cni set up link routes like `10.40.192.171 dev cali856adefd1c5 scope link`.  Initially proxy_arp of these pods did work.

But then calico-node still thought it was connected to 10.96.0.1:443, and ipvs has no health check against the kube-apiserver on nodeB.  calico-node thought these link routes were stale and after 10s of grace period, they were removed.  Only when calico-node initiates new connection to apiserver will those link routes reinstated and communication recover.

It seems at the moment we depend on net.ipv4.tcp_retries2, or net.ipv4.tcp_keepalive_xx settings to detect such event.  The default value for tcp_retries2 is 15, which amounts to about 15m.  It's too long in ha settings.

## Expected Behavior

calico-node connection to kube-apiserver can recover faster, preferably in less than 10s (the grace period)

## Current Behavior

Initially, newly migrated pods did have working network.  After 10s of grace period, link routes on the host sides will be removed by calico-node because it receives no notification from apiserver and as such thought they were stale.

## Possible Solution

According to https://github.com/kubernetes/client-go/issues/374 , client-go may eventually have connection health check option available.  At the moment a feature to make such thing available has been upstreamed to golang project and will be available in go1.15...

In the meantime, it seems kubelet alone already does such thing and will close all conns should health check fail.  https://github.com/kubernetes/kubernetes/pull/63492

It would be preferable calico can have such check sooner than later.

## Steps to Reproduce (for bugs)

1. On nodeA
  - remove all realservers of 10.96.0.1:443, except the one with nodeB's IP
  - docker rm -f calico-node-id, make sure calico-node connects (indirectly) to nodeB
2. Plug out nodeB
3. Schedule new pods to run on nodeA

## Context

n/a

## Your Environment

calico docker image tag 3.12.1
k8s 1.15.9-beta.0
centos 7.6

## Logs

tcpdump of calixx interface of calico-node-kubecontroller migrated to nodeA.  Notice that the initially pod network knows gateway mac address.  Only it cannot do tcp connect and ucast/bcast arp requests fail without response.

```
tcpdump: verbose output suppressed, use -v or -vv for full protocol decode
listening on cali6c5eb979b9c, link-type EN10MB (Ethernet), capture size 262144 bytes
18:37:23.000048 ee:ee:ee:ee:ee:ee > 33:33:00:00:00:02, ethertype IPv6 (0x86dd), length 70: fe80::ecee:eeff:feee:eeee > ff02::2: ICMP6, router solicitation, length 16
18:37:23.704023 5e:a6:a9:29:99:9d > ee:ee:ee:ee:ee:ee, ethertype IPv4 (0x0800), length 74: 10.40.132.103.41346 > 10.96.0.1.443: Flags [S], seq 400780869, win 28000, options [mss 1400,sackOK,TS val 84555984 ecr 0,nop,wscale 7], length 0
18:37:25.708034 5e:a6:a9:29:99:9d > ee:ee:ee:ee:ee:ee, ethertype IPv4 (0x0800), length 74: 10.40.132.103.41346 > 10.96.0.1.443: Flags [S], seq 400780869, win 28000, options [mss 1400,sackOK,TS val 84557988 ecr 0,nop,wscale 7], length 0
18:37:27.008043 ee:ee:ee:ee:ee:ee > 33:33:00:00:00:02, ethertype IPv6 (0x86dd), length 70: fe80::ecee:eeff:feee:eeee > ff02::2: ICMP6, router solicitation, length 16
18:37:29.720006 5e:a6:a9:29:99:9d > ee:ee:ee:ee:ee:ee, ethertype IPv4 (0x0800), length 74: 10.40.132.103.41346 > 10.96.0.1.443: Flags [S], seq 400780869, win 28000, options [mss 1400,sackOK,TS val 84562000 ecr 0,nop,wscale 7], length 0
18:37:33.768175 5e:a6:a9:29:99:9d > ee:ee:ee:ee:ee:ee, ethertype IPv4 (0x0800), length 74: 10.40.132.103.41488 > 10.96.0.1.443: Flags [S], seq 462050336, win 28000, options [mss 1400,sackOK,TS val 84566048 ecr 0,nop,wscale 7], length 0
18:37:34.770023 5e:a6:a9:29:99:9d > ee:ee:ee:ee:ee:ee, ethertype IPv4 (0x0800), length 74: 10.40.132.103.41488 > 10.96.0.1.443: Flags [S], seq 462050336, win 28000, options [mss 1400,sackOK,TS val 84567050 ecr 0,nop,wscale 7], length 0
18:37:36.776085 5e:a6:a9:29:99:9d > ee:ee:ee:ee:ee:ee, ethertype IPv4 (0x0800), length 74: 10.40.132.103.41488 > 10.96.0.1.443: Flags [S], seq 462050336, win 28000, options [mss 1400,sackOK,TS val 84569056 ecr 0,nop,wscale 7], length 0
18:37:40.784140 5e:a6:a9:29:99:9d > ee:ee:ee:ee:ee:ee, ethertype IPv4 (0x0800), length 74: 10.40.132.103.41488 > 10.96.0.1.443: Flags [S], seq 462050336, win 28000, options [mss 1400,sackOK,TS val 84573064 ecr 0,nop,wscale 7], length 0
18:37:45.800020 5e:a6:a9:29:99:9d > ee:ee:ee:ee:ee:ee, ethertype ARP (0x0806), length 42: Request who-has 169.254.1.1 tell 10.40.132.103, length 28
18:37:46.802000 5e:a6:a9:29:99:9d > ee:ee:ee:ee:ee:ee, ethertype ARP (0x0806), length 42: Request who-has 169.254.1.1 tell 10.40.132.103, length 28
18:37:47.804003 5e:a6:a9:29:99:9d > ee:ee:ee:ee:ee:ee, ethertype ARP (0x0806), length 42: Request who-has 169.254.1.1 tell 10.40.132.103, length 28
18:37:58.391148 5e:a6:a9:29:99:9d > ff:ff:ff:ff:ff:ff, ethertype ARP (0x0806), length 42: Request who-has 169.254.1.1 tell 10.40.132.103, length 28
18:37:59.392042 5e:a6:a9:29:99:9d > ff:ff:ff:ff:ff:ff, ethertype ARP (0x0806), length 42: Request who-has 169.254.1.1 tell 10.40.132.103, length 28
18:38:00.394007 5e:a6:a9:29:99:9d > ff:ff:ff:ff:ff:ff, ethertype ARP (0x0806), length 42: Request who-has 169.254.1.1 tell 10.40.132.103, length 28
18:38:01.396096 5e:a6:a9:29:99:9d > ff:ff:ff:ff:ff:ff, ethertype ARP (0x0806), length 42: Request who-has 169.254.1.1 tell 10.40.132.103, length 28
18:38:02.398006 5e:a6:a9:29:99:9d > ff:ff:ff:ff:ff:ff, ethertype ARP (0x0806), length 42: Request who-has 169.254.1.1 tell 10.40.132.103, length 28
18:38:03.400001 5e:a6:a9:29:99:9d > ff:ff:ff:ff:ff:ff, ethertype ARP (0x0806), length 42: Request who-has 169.254.1.1 tell 10.40.132.103, length 28
18:38:28.383756 5e:a6:a9:29:99:9d > ff:ff:ff:ff:ff:ff, ethertype ARP (0x0806), length 42: Request who-has 169.254.1.1 tell 10.40.132.103, length 28
18:38:29.384064 5e:a6:a9:29:99:9d > ff:ff:ff:ff:ff:ff, ethertype ARP (0x0806), length 42: Request who-has 169.254.1.1 tell 10.40.132.103, length 28
18:38:30.386023 5e:a6:a9:29:99:9d > ff:ff:ff:ff:ff:ff, ethertype ARP (0x0806), length 42: Request who-has 169.254.1.1 tell 10.40.132.103, length 28
18:38:31.388053 5e:a6:a9:29:99:9d > ff:ff:ff:ff:ff:ff, ethertype ARP (0x0806), length 42: Request who-has 169.254.1.1 tell 10.40.132.103, length 28
18:38:32.389998 5e:a6:a9:29:99:9d > ff:ff:ff:ff:ff:ff, ethertype ARP (0x0806), length 42: Request who-has 169.254.1.1 tell 10.40.132.103, length 28
18:38:33.393003 5e:a6:a9:29:99:9d > ff:ff:ff:ff:ff:ff, ethertype ARP (0x0806), length 42: Request who-has 169.254.1.1 tell 10.40.132.103, length 28
18:39:14.412818 5e:a6:a9:29:99:9d > ff:ff:ff:ff:ff:ff, ethertype ARP (0x0806), length 42: Request who-has 169.254.1.1 tell 10.40.132.103, length 28
18:39:15.413989 5e:a6:a9:29:99:9d > ff:ff:ff:ff:ff:ff, ethertype ARP (0x0806), length 42: Request who-has 169.254.1.1 tell 10.40.132.103, length 28
18:39:16.416015 5e:a6:a9:29:99:9d > ff:ff:ff:ff:ff:ff, ethertype ARP (0x0806), length 42: Request who-has 169.254.1.1 tell 10.40.132.103, length 28
18:39:17.418107 5e:a6:a9:29:99:9d > ff:ff:ff:ff:ff:ff, ethertype ARP (0x0806), length 42: Request who-has 169.254.1.1 tell 10.40.132.103, length 28
18:39:18.419997 5e:a6:a9:29:99:9d > ff:ff:ff:ff:ff:ff, ethertype ARP (0x0806), length 42: Request who-has 169.254.1.1 tell 10.40.132.103, length 28
18:39:19.422005 5e:a6:a9:29:99:9d > ff:ff:ff:ff:ff:ff, ethertype ARP (0x0806), length 42: Request who-has 169.254.1.1 tell 10.40.132.103, length 28
18:40:42.467435 5e:a6:a9:29:99:9d > ff:ff:ff:ff:ff:ff, ethertype ARP (0x0806), length 42: Request who-has 169.254.1.1 tell 10.40.132.103, length 28
18:40:43.467991 5e:a6:a9:29:99:9d > ff:ff:ff:ff:ff:ff, ethertype ARP (0x0806), length 42: Request who-has 169.254.1.1 tell 10.40.132.103, length 28
18:40:44.470007 5e:a6:a9:29:99:9d > ff:ff:ff:ff:ff:ff, ethertype ARP (0x0806), length 42: Request who-has 169.254.1.1 tell 10.40.132.103, length 28
18:40:45.472064 5e:a6:a9:29:99:9d > ff:ff:ff:ff:ff:ff, ethertype ARP (0x0806), length 42: Request who-has 169.254.1.1 tell 10.40.132.103, length 28
18:40:46.474003 5e:a6:a9:29:99:9d > ff:ff:ff:ff:ff:ff, ethertype ARP (0x0806), length 42: Request who-has 169.254.1.1 tell 10.40.132.103, length 28
18:40:47.476004 5e:a6:a9:29:99:9d > ff:ff:ff:ff:ff:ff, ethertype ARP (0x0806), length 42: Request who-has 169.254.1.1 tell 10.40.132.103, length 28
18:43:29.392333 5e:a6:a9:29:99:9d > ff:ff:ff:ff:ff:ff, ethertype ARP (0x0806), length 42: Request who-has 169.254.1.1 tell 10.40.132.103, length 28
18:43:29.392355 ee:ee:ee:ee:ee:ee > 5e:a6:a9:29:99:9d, ethertype ARP (0x0806), length 42: Reply 169.254.1.1 is-at ee:ee:ee:ee:ee:ee, length 28
18:43:29.392359 5e:a6:a9:29:99:9d > ee:ee:ee:ee:ee:ee, ethertype IPv4 (0x0800), length 74: 10.40.132.103.45134 > 10.96.0.1.443: Flags [S], seq 4215035758, win 28000, options [mss 1400,sackOK,TS val 84921672 ecr 0,nop,wscale 7], length 0
18:43:29.392431 ee:ee:ee:ee:ee:ee > 5e:a6:a9:29:99:9d, ethertype IPv4 (0x0800), length 74: 10.96.0.1.443 > 10.40.132.103.45134: Flags [S.], seq 40071671, ack 4215035759, win 27760, options [mss 1400,sackOK,TS val 84921672 ecr 84921672,nop,wscale 7], length 0
18:43:29.392452 5e:a6:a9:29:99:9d > ee:ee:ee:ee:ee:ee, ethertype IPv4 (0x0800), length 66: 10.40.132.103.45134 > 10.96.0.1.443: Flags [.], ack 1, win 219, options [nop,nop,TS val 84921672 ecr 84921672], length 0
```

calico-node logs

```
2020-07-09 03:58:50.212 [INFO][51] watchercache.go 206: Failed to perform list of current data during resync ListRoot="/calico/resources/v3/projectcalico.org/ippools" error=Get https://10.96.0.1:443/apis/crd.projectcalico.org/v1/ippools: dial tcp 10.96.0.1:443: connect: connection refused
2020-07-09 03:58:50.220 [INFO][51] watchercache.go 206: Failed to perform list of current data during resync ListRoot="/calico/resources/v3/projectcalico.org/nodes" error=Get https://10.96.0.1:443/api/v1/nodes: dial tcp 10.96.0.1:443: connect: no route to host


2020-07-08 10:37:17.765 [INFO][50] int_dataplane.go 627: Linux interface addrs changed. addrs=set.mapSet{"fe80::ecee:eeff:feee:eeee":set.empty{}} ifaceName="cali6c5eb979b9c"
2020-07-08 10:37:17.766 [INFO][50] int_dataplane.go 594: Linux interface state changed. ifaceName="cali6c5eb979b9c" state="up"
2020-07-08 10:37:17.766 [INFO][50] int_dataplane.go 858: Received interface addresses update msg=&intdataplane.ifaceAddrsUpdate{Name:"cali6c5eb979b9c", Addrs:set.mapSet{"fe80::ecee:eeff:feee:eeee":set.empty{}}}
2020-07-08 10:37:17.766 [INFO][50] hostip_mgr.go 84: Interface addrs changed. update=&intdataplane.ifaceAddrsUpdate{Name:"cali6c5eb979b9c", Addrs:set.mapSet{"fe80::ecee:eeff:feee:eeee":set.empty{}}}
2020-07-08 10:37:17.766 [INFO][50] int_dataplane.go 840: Received interface update msg=&intdataplane.ifaceUpdate{Name:"cali6c5eb979b9c", State:"up"}
...
 
 
2020-07-08 10:37:17.866 [INFO][50] route_table.go 556: Syncing routes: found unexpected route; ignoring due to grace period. dest=10.40.132.103/32 ifaceName="cali6c5eb979b9c" ipVersion=0x4
2020-07-08 10:37:17.866 [INFO][50] route_table.go 364: Interface in cleanup grace period, will retry after. ifaceName="cali6c5eb979b9c" ipVersion=0x4
...
 
 
2020-07-08 10:37:35.177 [INFO][50] route_table.go 561: Syncing routes: removing old route. dest=10.40.132.103/32 ifaceName="cali6c5eb979b9c" ipVersion=0x4 routeProblems=[]string{"unexpected route"}
2020-07-08 10:37:35.177 [INFO][50] route_table.go 561: Syncing routes: removing old route. dest=10.40.132.121/32 ifaceName="calid1b89274120" ipVersion=0x4 routeProblems=[]string{"unexpected route"}
2020-07-08 10:37:35.178 [INFO][50] route_table.go 561: Syncing routes: removing old route. dest=10.40.132.110/32 ifaceName="cali3a4b0e67050" ipVersion=0x4 routeProblems=[]string{"unexpected route"}
2020-07-08 10:37:35.178 [INFO][50] route_table.go 561: Syncing routes: removing old route. dest=10.40.132.119/32 ifaceName="cali6e8f4a3f2f2" ipVersion=0x4 routeProblems=[]string{"unexpected route"}
2020-07-08 10:37:35.179 [INFO][50] route_table.go 561: Syncing routes: removing old route. dest=10.40.132.68/32 ifaceName="cali67b64bf27d9" ipVersion=0x4 routeProblems=[]string{"unexpected route"}
2020-07-08 10:37:35.179 [INFO][50] conntrack.go 78: Removing conntrack flows ip=10.40.132.68
2020-07-08 10:37:35.180 [INFO][50] conntrack.go 78: Removing conntrack flows ip=10.40.132.103
2020-07-08 10:37:35.180 [INFO][50] conntrack.go 78: Removing conntrack flows ip=10.40.132.121
2020-07-08 10:37:35.185 [INFO][50] conntrack.go 78: Removing conntrack flows ip=10.40.132.110
2020-07-08 10:37:35.185 [INFO][50] conntrack.go 78: Removing conntrack flows ip=10.40.132.119
...

```

**Comment by fasaxc** [comment]
Thanks for digging into this and diagnosing the issue. All our components assume that the kube-client detects failures in a timely fashion so, if that's not he case, (which I think you've proved) then we can get stuck.
